{
    "id": "antidote",
    "name": "Antidote",
    "category": "medicine",
    "effect": "cure_poison",
    "effect_value": null,
    "description": "A spray-type medicine to heal a single Pokémon of the poison status condition.",
    "buy_price": 100,
    "sell_price": 50,
    "is_key_item": false,
    "is_custom": false,
    "zone_association": null
}